{
  "$schema": "../../../../../../../../docs/skill-projection-document.schema.json",
  "template_type": "ontology_projection",
  "projection_version": "1.0.0",
  "projection": {
    "projection_id": "software-developer-task-execution-workflow-contract-v1",
    "projection_type": "workflow_contract_projection",
    "target_name": "SoftwareDeveloperTaskExecutionWorkflowContract",
    "target_format": "workflow_contract",
    "target_runtime": "openclaw_gateway",
    "projection_goal": "Provide the software-developer skill with a workflow contract for execution planning, source-aware review checkpoints, and bounded implementation transitions.",
    "source_slice": {
      "path": "../../../../../ontology_extraction/examples/ready/sample.json",
      "slice_topic": "skill loading order, source precedence, and eligibility filtering",
      "schema_version": "1.0.0"
    },
    "intended_consumers": [
      "software_developer_skill",
      "workflow_orchestrator"
    ]
  },
  "mapping_policy": {
    "preserve_source_trace": true,
    "preserve_constraints": true,
    "relation_flattening_policy": "disallow_by_default",
    "unresolved_item_policy": "block_or_escalate",
    "dropped_item_policy": "disallow_drop",
    "prompt_assumption_policy": "disallow_unmapped_terms"
  },
  "concept_mappings": [
    {
      "concept_id": "C1",
      "projection_action": "map",
      "target_kind": "workflow_input",
      "target_name": "taskExecutionConfig",
      "target_path": "workflow.inputs.taskExecutionConfig",
      "source_ids": [
        "S2",
        "S3"
      ],
      "notes": "Expose execution configuration as a workflow input so downstream planning steps inherit the same bounded configuration context as the source slice."
    },
    {
      "concept_id": "C2",
      "projection_action": "map",
      "target_kind": "workflow_input",
      "target_name": "executionSourceSelection",
      "target_path": "workflow.steps.collectExecutionContext.outputs.executionSourceSelection",
      "source_ids": [
        "S2",
        "S3"
      ],
      "notes": "Treat source selection as a workflow-visible payload so review checkpoints can validate source precedence before implementation continues."
    },
    {
      "concept_id": "C3",
      "projection_action": "map",
      "target_kind": "workflow_input",
      "target_name": "candidateExecutableSkills",
      "target_path": "workflow.steps.selectExecutableSkills.outputs.skillDefinitions",
      "source_ids": [
        "S2",
        "S3"
      ],
      "notes": "Make candidate skill definitions a first-class workflow payload so execution and review transitions remain explicit."
    },
    {
      "concept_id": "C4",
      "projection_action": "map",
      "target_kind": "enum",
      "target_name": "ExecutionSourceTier",
      "target_path": "workflow.sharedEnums.executionSourceTier",
      "source_ids": [
        "S1",
        "S2",
        "S3",
        "S4"
      ],
      "notes": "Keep source tiers as a shared enum so review and implementation stages speak the same precedence language."
    }
  ],
  "relation_mappings": [
    {
      "relation_id": "R3",
      "projection_action": "map",
      "target_kind": "workflow_edge",
      "target_name": "ExecutableSkillDependsOnExecutionSourceSelection",
      "representation": "workflow_step_edge",
      "source_ids": [
        "S2",
        "S3"
      ],
      "notes": "Represent the source-aware dependency as an explicit edge between selection and execution planning steps."
    }
  ],
  "constraint_mappings": [
    {
      "constraint_id": "K1",
      "projection_action": "map",
      "target_kind": "workflow_precondition",
      "target_name": "ResolveExecutionSourcePrecedenceBeforeImplementation",
      "severity_mapping": "high -> blocking_workflow_precondition",
      "source_ids": [
        "S1",
        "S2",
        "S4"
      ],
      "notes": "Require execution workflows to resolve source precedence before any implementation or review transition continues."
    }
  ],
  "prompt_projection": {
    "allowed_terms": [
      "task_execution_config",
      "execution_source_selection",
      "candidate_executable_skills",
      "execution_source_tier"
    ],
    "forbidden_assumptions": [
      "Do not skip source-precedence review checkpoints in execution workflows.",
      "Do not model execution source tiers as ad hoc text values."
    ],
    "required_clarifications": [],
    "reasoning_paths": [
      "task_execution_config -> collect_execution_context -> select_executable_skills -> review_execution_plan",
      "execution_source_tier -> source_precedence -> implementation_transition"
    ],
    "source_digest": [
      "Primary source: S2 src/OpenClaw.Core/Skills/SkillLoader.cs",
      "Primary source: S3 src/OpenClaw.Core/Skills/SkillModels.cs",
      "Supporting source: S1 docs/skillloader-loadall-analysis.md"
    ]
  },
  "delivery_artifacts": [
    {
      "artifact_name": "task-execution.workflow-contract.json",
      "artifact_type": "workflow_contract",
      "path": "src/OpenClaw.Gateway/skills/software-developer/contracts/generated/task-execution/task-execution.workflow-contract.json",
      "status": "planned"
    }
  ],
  "dropped_items": [],
  "open_questions": [],
  "meta": {
    "generated_at": "2026-04-21T00:00:00Z",
    "generated_by": "ontology_extraction",
    "workspace": "kingcrab",
    "notes": "This consumer-skill workflow projection gives software-developer an execution workflow contract for source-aware planning and review checkpoints."
  }
}