{
  "$schema": "../../../../../../../../docs/skill-projection-document.schema.json",
  "template_type": "ontology_projection",
  "projection_version": "1.0.0",
  "projection": {
    "projection_id": "software-developer-memory-session-prompt-constraint-v1",
    "projection_type": "prompt_constraint_projection",
    "target_name": "SoftwareDeveloperMemorySessionPromptPolicy",
    "target_format": "system_prompt_policy",
    "target_runtime": "llm_orchestrator",
    "projection_goal": "Provide the software-developer skill with a prompt-side contract for memory and session requests so recall, retention, and clarification behavior stays bounded to the mapped topic.",
    "source_slice": {
      "path": "../../../../../../../../docs/openclaw-memory-recall-and-retention.md",
      "slice_topic": "memory recall, session management, and retention guardrails",
      "schema_version": "1.0.0"
    },
    "intended_consumers": [
      "software_developer_skill",
      "prompt_orchestrator"
    ]
  },
  "mapping_policy": {
    "preserve_source_trace": true,
    "preserve_constraints": true,
    "relation_flattening_policy": "disallow_by_default",
    "unresolved_item_policy": "block_or_escalate",
    "dropped_item_policy": "disallow_drop",
    "prompt_assumption_policy": "disallow_unmapped_terms"
  },
  "prompt_projection": {
    "allowed_terms": [
      "memory_store",
      "session_manager",
      "session_recall",
      "retention_policy"
    ],
    "forbidden_assumptions": [
      "Do not assume every session lookup implies long-term memory persistence.",
      "Do not invent retention semantics that are not grounded in the mapped memory or session sources."
    ],
    "required_clarifications": [
      "Clarify whether the request is about transient session behavior, persisted memory behavior, or both before proposing policy changes."
    ],
    "reasoning_paths": [
      "session_manager -> session_recall -> retention_policy",
      "memory_store -> persisted_memory -> retrieval_boundary"
    ],
    "source_digest": [
      "Primary source: docs/openclaw-memory-recall-and-retention.md",
      "Supporting source: docs/OpenClaw-Session-Management.md",
      "Supporting source: docs/openclaw-gateway-startup-layers.md"
    ]
  },
  "delivery_artifacts": [],
  "dropped_items": [],
  "open_questions": [],
  "meta": {
    "generated_at": "2026-04-22T00:00:00Z",
    "generated_by": "ncrew-ontology",
    "workspace": "kingcrab",
    "notes": "This is the minimal fourth-topic skeleton for memory-session. Expand with additional target views only when the consumer needs executable models, schemas, or workflow artifacts."
  }
}
