{
  "$schema": "../../../../../../../../docs/skill-projection-document.schema.json",
  "template_type": "ontology_projection",
  "projection_version": "1.0.0",
  "projection": {
    "projection_id": "software-developer-skill-loading-workflow-contract-v1",
    "projection_type": "workflow_contract_projection",
    "target_name": "SoftwareDeveloperSkillLoadingWorkflowContract",
    "target_format": "workflow_contract",
    "target_runtime": "openclaw_gateway",
    "projection_goal": "Provide the software-developer skill with a workflow contract for orchestrating discovery, source resolution, and eligibility filtering as explicit execution steps under the skill-loading topic.",
    "source_slice": {
      "path": "../../../../../ontology_extraction/examples/ready/sample.json",
      "slice_topic": "skill loading order, source precedence, and eligibility filtering",
      "schema_version": "1.0.0"
    },
    "intended_consumers": [
      "software_developer_skill",
      "workflow_orchestrator",
      "tool_contract_generator"
    ]
  },
  "mapping_policy": {
    "preserve_source_trace": true,
    "preserve_constraints": true,
    "relation_flattening_policy": "disallow_by_default",
    "unresolved_item_policy": "block_or_escalate",
    "dropped_item_policy": "disallow_drop",
    "prompt_assumption_policy": "disallow_unmapped_terms"
  },
  "concept_mappings": [
    {
      "concept_id": "C1",
      "projection_action": "map",
      "target_kind": "workflow_input",
      "target_name": "skillsConfig",
      "target_path": "workflow.inputs.skillsConfig",
      "source_ids": [
        "S2",
        "S3"
      ],
      "notes": "Expose the top-level skills configuration as the primary workflow input so the consumer skill starts from the same bounded config object the runtime uses."
    },
    {
      "concept_id": "C2",
      "projection_action": "map",
      "target_kind": "workflow_input",
      "target_name": "skillLoadConfig",
      "target_path": "workflow.steps.parseConfig.outputs.skillLoadConfig",
      "source_ids": [
        "S2",
        "S3"
      ],
      "notes": "Treat load configuration as an explicit workflow payload so source toggles and extra directories stay reviewable across execution steps."
    },
    {
      "concept_id": "C3",
      "projection_action": "map",
      "target_kind": "workflow_input",
      "target_name": "candidateSkillDefinitions",
      "target_path": "workflow.steps.discoverSkills.outputs.skillDefinitions",
      "source_ids": [
        "S2",
        "S3"
      ],
      "notes": "Make discovered skill definitions a first-class workflow payload so overwrite resolution and eligibility decisions remain explicit."
    },
    {
      "concept_id": "C4",
      "projection_action": "map",
      "target_kind": "enum",
      "target_name": "SkillSourceTier",
      "target_path": "workflow.sharedEnums.skillSourceTier",
      "source_ids": [
        "S1",
        "S2",
        "S3",
        "S4"
      ],
      "notes": "Keep source tiers as a shared workflow enum so precedence-sensitive routing stays explicit across steps."
    }
  ],
  "relation_mappings": [
    {
      "relation_id": "R3",
      "projection_action": "map",
      "target_kind": "workflow_edge",
      "target_name": "DiscoveredSkillBindsToSkillSource",
      "representation": "workflow_step_edge",
      "source_ids": [
        "S2",
        "S3"
      ],
      "notes": "Represent the source-binding relation as an explicit edge between discovery output and source-resolution logic so the workflow contract preserves provenance."
    }
  ],
  "constraint_mappings": [
    {
      "constraint_id": "K1",
      "projection_action": "map",
      "target_kind": "workflow_precondition",
      "target_name": "HigherPrioritySourcesMustWinBeforeEligibilityFiltering",
      "severity_mapping": "high -> blocking_workflow_precondition",
      "source_ids": [
        "S1",
        "S2",
        "S4"
      ],
      "notes": "Make source precedence a precondition on the overwrite-resolution step so eligibility filtering never runs on a semantically inconsistent skill set."
    }
  ],
  "prompt_projection": {
    "allowed_terms": [
      "skills_config",
      "skill_load_config",
      "candidate_skill_definitions",
      "skill_source_tier"
    ],
    "forbidden_assumptions": [
      "Do not treat source precedence as an optional workflow branch.",
      "Do not model source tier as free text in the workflow contract."
    ],
    "required_clarifications": [],
    "reasoning_paths": [
      "skills_config -> parse_config -> discover_skills -> resolve_source_precedence -> filter_eligible_skills",
      "skill_definition -> skill_source_tier -> overwrite_decision"
    ],
    "source_digest": [
      "Primary source: S2 src/OpenClaw.Core/Skills/SkillLoader.cs",
      "Primary source: S3 src/OpenClaw.Core/Skills/SkillModels.cs",
      "Supporting source: S1 docs/skillloader-loadall-analysis.md"
    ]
  },
  "delivery_artifacts": [
    {
      "artifact_name": "skill-loading.workflow-contract.json",
      "artifact_type": "workflow_contract",
      "path": "src/OpenClaw.Gateway/skills/software-developer/contracts/generated/skill-loading/skill-loading.workflow-contract.json",
      "status": "planned"
    }
  ],
  "dropped_items": [],
  "open_questions": [],
  "meta": {
    "generated_at": "2026-04-21T00:00:00Z",
    "generated_by": "ontology_extraction",
    "workspace": "kingcrab",
    "notes": "This consumer-skill workflow projection gives software-developer an execution contract for skill-loading orchestration while preserving provenance, precedence, and eligibility gating."
  }
}